{
  "schema_version": 1,
  "task_id": "TASK-SUP-REMEDIATION-001",
  "status": "active",
  "request_digest": "sha256:SUP-REMEDIATION-001",
  "attempt": 1,
  "runtime_loss_count": 0,
  "claim": {
    "execution_id": "EXEC-SUP-REMEDIATION-001-DIRECT",
    "generation": 31,
    "slot_id": "direct-owner-runtime",
    "claimed_at": "2026-09-23T14:19:05Z"
  },
  "latest_checkpoint": null,
  "request_blob_sha": "622b39d7b7d95de32693df46c06c110fc05d75f3"
}
