{
  "schema_version": 1,
  "task_id": "TASK-INT-AUDITOR-001",
  "status": "queued",
  "request_digest": "sha256:54b53bee75b274ffee4d48269985358b271bf2ebd2c1492ab4b360e1a76481c4",
  "attempt": 0,
  "runtime_loss_count": 0,
  "claim": null,
  "latest_checkpoint": null,
  "request_blob_sha": "28e567b6ea6aebaadf80e12cfabd27168c7256c4"
}
