{
  "schema_version": 1,
  "task_id": "TASK-CC-ACP-REMEDIATION-001",
  "status": "completed",
  "request_digest": "sha256:2f8d985a6a90b5aebf0b20f881be836274c47ee041cea8e7e8134abc753cf32f",
  "attempt": 1,
  "runtime_loss_count": 0,
  "claim": null,
  "latest_checkpoint": null,
  "request_blob_sha": "d063638ff33b90e7eb61ca6a5133f89654d6d603"
}
