{
  "schema_version": 1,
  "task_id": "TASK-INT-AUDITOR-002",
  "status": "queued",
  "request_digest": "sha256:9fda6a0ef5b793a0a95800319fb4e014748e0839cbd18c3198f990c0e58ae5fe",
  "attempt": 0,
  "runtime_loss_count": 0,
  "claim": null,
  "latest_checkpoint": null,
  "request_blob_sha": "2ee517310f3127a309b3d3026ee8f157d60afe35"
}
