{
  "schema_version": 1,
  "task_id": "TASK-INT-PM-002",
  "status": "active",
  "request_digest": "sha256:fae2cfb252ef0cb0440086ee0351bc5188618e2c24d731459f674134671e5e7e",
  "attempt": 1,
  "runtime_loss_count": 1,
  "claim": {
    "execution_id": "exec-task-int-pm-002-20260923T122045Z-probe1",
    "generation": 9,
    "slot_id": "probe-1",
    "claimed_at": "2026-09-23T12:21:31Z"
  },
  "latest_checkpoint": null,
  "request_blob_sha": "3ff4eed2cba5754738f50721e21f49874885a692"
}
